Spoiler,"Frank's con game is next lvl, dude"
Spoiler,"When Frank switched IDs on the fly, it was wild"
Spoiler,"Frank dodgin the feds like a boss, no cap"
Spoiler,"That check forgery montage had me shook"
Spoiler,"Frank's smooth scams r lit, fr"
Spoiler,"The scene when Frank pulled a slick con was insane"
Spoiler,"When Frank faked his own downfall, I was shook"
Spoiler,"Frank's hustle in the airport scene was unreal"
Spoiler,"When Frank got away with it, I was like, 'dang'"
Spoiler,"That moment when Frank flipped his game was cray"
Spoiler,"Frank switchin up cons mid-run is wild"
Spoiler,"The twist when Frank got caught was a total gut punch"
Spoiler,"When Frank played the system, it was epic"
Spoiler,"Frank's double life hittin peak drama, tbh"
Spoiler,"That scene with Frank dodgin cops was mad intense"
Spoiler,"When Frank pulled off the ultimate scam, I was floored"
Spoiler,"Frank's slick moves in the con game are savage"
Spoiler,"That moment when his true self came out was heavy"
Spoiler,"When Frank's cons start unravelin, it gets raw"
Spoiler,"Frank's final scam was straight fire, no lie"
Spoiler,"When Frank almost got nabbed, it was so tense"
Spoiler,"Frank switchin up his style mid-con was dope"
Spoiler,"That twist when Frank had a change of heart was real"
Spoiler,"When the feds closed in on Frank, things got lit"
Spoiler,"Frank's clever forgeries r next lvl, fr"
Spoiler,"When Frank's smooth talk got him out, it was epic"
Spoiler,"That scene with Frank's quick getaway was wild"
Spoiler,"Frank's hustle in every scam is on point"
Spoiler,"When Frank's game started unravelin, it hit hard"
Spoiler,"Frank's con artistry is pure genius, tbh"
Spoiler,"That twist where Frank's real ID dropped was savage"
Spoiler,"When Frank's cons turned dark, it was heavy"
Spoiler,"Frank pullin off a last-min scam was unreal"
Spoiler,"When Frank switched targets mid-run, it was a flex"
Spoiler,"That moment when Frank almost got busted was brutal"
Spoiler,"When Frank's plan took a crazy turn, I was shook"
Spoiler,"Frank's slick moves in the bank heist were lit"
Spoiler,"That twist where Frank played both sides was epic"
Spoiler,"When Frank's double-cross got revealed, it was raw"
Spoiler,"Frank's style in the cons is mad slick"
Spoiler,"That moment when Frank flipped the script was wild"
Spoiler,"When Frank's charm turned into hustle, it was dope"
Spoiler,"Frank's con game got a serious upgrade, no cap"
Spoiler,"That scene when Frank dodged the feds was next lvl"
Spoiler,"When Frank's true game came out, it hit hard"
Spoiler,"Frank's masterful scams r crazy legit"
Spoiler,"That twist when Frank nearly got caught was insane"
Spoiler,"When Frank played with identities, it was wild"
Spoiler,"Frank's hustle in the final con was pure art"
Spoiler,"That moment when Frank outsmarted everyone was epic"
Spoiler,"When Frank pulled a major switch-up, it was dope"
Spoiler,"Frank's con game is just too slick to handle"
Spoiler,"That scene where Frank pulled off the slickest con was savage"
Spoiler,"When Frank's secret got exposed, it was heavy"
Spoiler,"Frank's way of dodging the law is straight fire"
Spoiler,"That twist when Frank flipped his persona was unreal"
Spoiler,"When Frank's con took an unexpected turn, I was shook"
Spoiler,"Frank's smooth scams are on another lvl"
Spoiler,"That moment when Frank risked it all was intense"
Spoiler,"When Frank's hustle got risky, it was pure drama"
Spoiler,"Frank's game got darker real quick, no lie"
Spoiler,"That scene where Frank pulled off the slickest con was epic"
Spoiler,"When Frank's plan almost fell apart, it was wild"
Spoiler,"Frank's next lvl con moves are straight-up dope"
Spoiler,"That twist when Frank's true colors came out was heavy"
Spoiler,"When Frank played the long con, it was a flex"
Spoiler,"Frank's hustle in every scam is mad intense"
Spoiler,"That moment when Frank nearly got pinned was brutal"
Spoiler,"When Frank switched tactics, it was totally wild"
Spoiler,"Frank's con skills are unreal, fr"
Spoiler,"That scene where Frank got away clean was epic"
Spoiler,"When Frank's scheme started to unravel, it got raw"
Spoiler,"Frank's smooth deception is somethin else, tbh"
Spoiler,"That twist when Frank's secret plan dropped was savage"
Spoiler,"When Frank's hustle hit its peak, it was dope"
Spoiler,"Frank's quick wit in the cons is off the charts"
Spoiler,"That moment when Frank played all sides was intense"
Spoiler,"When Frank pulled a risky move, it was a major flex"
Spoiler,"Frank's double life got real dramatic, no cap"
Spoiler,"That scene when Frank's con flipped the game was wild"
Spoiler,"When Frank's smooth scam got too risky, it hit hard"
Spoiler,"Frank's style in the cons is pure art, fr"
Spoiler,"That twist when Frank's true intent was revealed was epic"
Spoiler,"When Frank's con went off script, I was shook"
Spoiler,"Frank's rapid-fire cons are crazy intense"
Spoiler,"That moment when Frank's hustle took a dark turn was raw"
Spoiler,"When Frank played the ultimate long con, it was dope"
Spoiler,"Frank's clever tactics in the cons are next lvl"
Spoiler,"That twist where Frank's game got flipped was savage"
Spoiler,"When Frank's hustle got exposed, it was brutal"
Spoiler,"Frank's con game is mad lit, no lie"
Spoiler,"That scene when Frank pulled off a heist was unreal"
Spoiler,"When Frank's double life got messy, it hit different"
Spoiler,"Frank's smooth scams never fail to impress"
Spoiler,"That moment when Frank's con crumbled was a total shock"
Spoiler,"When Frank's hustle was on full display, it was epic"
Spoiler,"Frank's con artistry is pure next lvl genius"
Spoiler,"That twist when Frank's plan unraveled was heavy"
Spoiler,"When Frank's slick moves got the best of him, it was wild"
Spoiler,"Frank's hustle in the final act was straight savage"
Non-Spoiler,"Loving the slick vibe of this movie"
Non-Spoiler,"The overall style of the film is mad cool"
Non-Spoiler,"Really into the smooth storytelling here"
Non-Spoiler,"The vibe is chill n hella engaging"
Non-Spoiler,"Loving the retro con vibe, no spoils"
Non-Spoiler,"This movie's energy is on point, fr"
Non-Spoiler,"Really diggin' the old-school hustle in the film"
Non-Spoiler,"The style is fresh n the narrative's tight"
Non-Spoiler,"Loving the mix of drama n slick cons"
Non-Spoiler,"The film nails that smooth, retro energy"
Non-Spoiler,"Really enjoying the clever vibe of the movie"
Non-Spoiler,"The overall tone is chill n unspoiled"
Non-Spoiler,"Loving the authentic, old-school feel of it"
Non-Spoiler,"The movie's style is both cool n engaging"
Non-Spoiler,"Really into the vibe w/o any major deets"
Non-Spoiler,"The narrative flows smooth n keeps it real"
Non-Spoiler,"Loving the understated, classic hustle in the film"
Non-Spoiler,"The overall energy is fresh n mad dope"
Non-Spoiler,"Really enjoying the slick n smooth storytelling"
Non-Spoiler,"The vibe here is cool, crisp, n spoiler-free"
Non-Spoiler,"Loving the retro style n subtle drama"
Non-Spoiler,"The film's energy is chill n totally engaging"
Non-Spoiler,"Really into the smooth, no-spoil narrative"
Non-Spoiler,"The overall feel is authentic n unspoiled"
Non-Spoiler,"Loving the vibe of classic cons w/o the deets"
Non-Spoiler,"This movie's flow is slick n hella cool"
Non-Spoiler,"Really enjoying the vibe that's raw n real"
Non-Spoiler,"The tone is low-key n super engaging"
Non-Spoiler,"Loving the blend of retro n modern energy"
Non-Spoiler,"The film's style is effortlessly cool n chill"
Non-Spoiler,"Really diggin' the vibe w/o any spillin'"
Non-Spoiler,"The overall narrative is smooth n on point"
Non-Spoiler,"Loving the way it keeps the mystery intact"
Non-Spoiler,"The vibe is laid-back n hella engaging"
Non-Spoiler,"Really into the cool, understated style here"
Non-Spoiler,"The film nails that authentic, slick con feel"
Non-Spoiler,"Loving the mix of drama n retro swag"
Non-Spoiler,"The vibe is cool n totally spoiler-free"
Non-Spoiler,"Really enjoying the clear n engaging narrative"
Non-Spoiler,"The overall style is fresh, clean, n dope"
Non-Spoiler,"Loving the old-school charm of the film"
Non-Spoiler,"The movie's tone is chill n down-to-earth"
Non-Spoiler,"Really into the vibe that's smart n smooth"
Non-Spoiler,"The overall energy is low-key n engaging"
Non-Spoiler,"Loving the slick, retro narrative w/o spoils"
Non-Spoiler,"The film's style is clean, cool, n crisp"
Non-Spoiler,"Really enjoying the vibe that's honest n chill"
Non-Spoiler,"The overall feel is smooth n unspoiled"
Non-Spoiler,"Loving the mix of classic style n fresh energy"
Non-Spoiler,"The vibe here is raw, real, n spoiler-free"
Non-Spoiler,"Really diggin' the understated coolness of the film"
Non-Spoiler,"The film nails a vibe that's both classic n new"
Non-Spoiler,"Loving the authentic energy n slick storytelling"
Non-Spoiler,"The overall tone is chill n hella engaging"
Non-Spoiler,"Really into the smooth, classic con vibe"
Non-Spoiler,"The vibe is low-key, cool, n totally unspoiled"
Non-Spoiler,"Loving the clear, engaging style of the film"
Non-Spoiler,"The movie's narrative is slick n effortlessly cool"
Non-Spoiler,"Really enjoying the fresh, clean energy throughout"
Non-Spoiler,"The overall vibe is classic with a modern twist"
Non-Spoiler,"Loving the understated n chill tone here"
Non-Spoiler,"The film nails that authentic, raw energy"
Non-Spoiler,"Really into the vibe that stays cool n unspoiled"
Non-Spoiler,"The overall style is smooth, clear, n engaging"
Non-Spoiler,"Loving the mix of retro charm n modern feel"
Non-Spoiler,"The movie's energy is low-key n seriously dope"
Non-Spoiler,"Really enjoying the vibe that's classic n engaging"
Non-Spoiler,"The overall narrative is clean n spoiler-free"
Non-Spoiler,"Loving the cool, authentic con vibe of the film"
Non-Spoiler,"The vibe is raw, smart, n hella engaging"
Non-Spoiler,"Really into the film's chill n clear style"
Non-Spoiler,"The overall feel is classic, smooth, n unspoiled"
Non-Spoiler,"Loving the understated energy n crisp visuals"
Non-Spoiler,"The movie nails a vibe that's both timeless n fresh"
Non-Spoiler,"Really enjoying the clear, smart narrative throughout"
Non-Spoiler,"The overall tone is laid-back n seriously cool"
Non-Spoiler,"Loving the blend of retro style with modern vibes"
Non-Spoiler,"The film's narrative is smooth n totally unspoiled"
Non-Spoiler,"Really diggin' the vibe that's chill n authentic"
Non-Spoiler,"The overall energy is cool, clear, n engaging"
Non-Spoiler,"Loving the simple, slick storytelling in the movie"
Non-Spoiler,"The vibe here is down-to-earth n spoiler-free"
Non-Spoiler,"Really into the film's mix of classic n fresh style"
Non-Spoiler,"The overall narrative is smooth, clear, n dope"
Non-Spoiler,"Loving the authentic vibe n raw energy of the film"
Non-Spoiler,"The movie's tone is chill, smart, n spoiler-free"
Non-Spoiler,"Really enjoying the vibe that's effortlessly cool"
Non-Spoiler,"The overall style is classic, clean, n engaging"
Non-Spoiler,"Loving the low-key, authentic narrative of the film"
Non-Spoiler,"The vibe is raw, real, n totally unspoiled"
Non-Spoiler,"Really into the film's clear, engaging storytelling"
Non-Spoiler,"The overall energy is classic with a modern touch"
Non-Spoiler,"Loving the mix of honest, smooth style n vibe"
Non-Spoiler,"The movie nails a vibe that's both cool n crisp"
Non-Spoiler,"Really enjoying the clear narrative n chill tone"
Non-Spoiler,"The overall feel is low-key, classic, n spoiler-free"